{
  "version": 1,
  "author": "Maverick",
  "editor": "wokwi",
  "parts": [
    { "type": "wokwi-arduino-nano", "id": "nano", "top": 0, "left": 0, "attrs": {} },
    { "type": "board-ssd1306", "id": "oled1", "top": 89.5, "left": 19.05, "attrs": {} },
    {
      "type": "wokwi-pushbutton",
      "id": "btn1",
      "top": 87.7,
      "left": 136.24,
      "attrs": { "color": "green", "key": "ArrowUp" }
    },
    {
      "type": "wokwi-pushbutton",
      "id": "btn2",
      "top": 134.3,
      "left": 135.54,
      "attrs": { "color": "green", "key": "ArrowDown" }
    },
    {
      "type": "wokwi-buzzer",
      "id": "bz1",
      "top": -103.22,
      "left": 59.98,
      "attrs": { "volume": "0.1" }
    },
    {
      "type": "wokwi-resistor",
      "id": "r1",
      "top": -22.03,
      "left": 29.82,
      "attrs": { "value": "1000" }
    }
  ],
  "connections": [
    [ "nano:A4", "oled1:SDA", "gold", [ "v0" ] ],
    [ "oled1:SCL", "nano:A5", "cyan", [ "v-20.36", "h20.38" ] ],
    [ "oled1:VCC", "nano:3.3V", "red", [ "v-20.07", "h-37.37" ] ],
    [ "oled1:GND", "nano:GND.1", "black", [ "v-12.82", "h87.28" ] ],
    [ "btn1:2.l", "btn2:2.l", "black", [ "h-6.06", "v46.8" ] ],
    [ "btn1:2.l", "nano:GND.1", "black", [ "h-6.51", "v-36.84", "h14.77" ] ],
    [ "btn1:1.r", "nano:2", "black", [ "h13.06", "v-114.15", "h-100.6" ] ],
    [ "btn2:1.r", "nano:3", "black", [ "v-0.29", "h14.22", "v-160.46", "h-110.66" ] ],
    [ "bz1:2", "r1:2", "red", [ "v0" ] ],
    [ "r1:1", "nano:11", "red", [ "h-0.55", "v50.86" ] ],
    [ "bz1:1", "nano:GND.2", "black", [ "h34.91", "v64.63" ] ]
  ]
}